{
  "$schema": "../../../metamode.schema.json",
  "name": "windows",
  "description": "Window-wrapped components for the DraggableWindow-based window management system",
  "tags": ["windows", "ui", "layout"],
  "files": {
    "test-utils.ts": {
      "description": "Shared test utilities for window component tests"
    },
    "ActionHistoryWindow.test.ts": {
      "description": "Tests for the ActionHistoryWindow component"
    },
    "ActionHistoryWindow.vue": {
      "description": "Window wrapper for the ActionHistory component"
    },
    "CommunityGalleryWindow.test.ts": {
      "description": "Tests for the CommunityGalleryWindow component"
    },
    "CommunityGalleryWindow.vue": {
      "description": "Window wrapper for the CommunityGallery component"
    },
    "ConversationPanelWindow.test.ts": {
      "description": "Tests for the ConversationPanelWindow component"
    },
    "ConversationPanelWindow.vue": {
      "description": "Window wrapper for the ConversationPanel component"
    },
    "CubePreviewWindow.test.ts": {
      "description": "Tests for the CubePreviewWindow component"
    },
    "CubePreviewWindow.vue": {
      "description": "Window wrapper for the CubePreview component"
    },
    "ExportPanelWindow.test.ts": {
      "description": "Tests for the ExportPanelWindow component"
    },
    "ExportPanelWindow.vue": {
      "description": "Window wrapper for the ExportPanel component"
    },
    "ExtendedSearchPanelWindow.test.ts": {
      "description": "Tests for the ExtendedSearchPanelWindow component"
    },
    "ExtendedSearchPanelWindow.vue": {
      "description": "Window wrapper for the ExtendedSearchPanel component"
    },
    "GalleryWindow.test.ts": {
      "description": "Tests for the GalleryWindow component"
    },
    "GalleryWindow.vue": {
      "description": "Window wrapper for the Gallery component"
    },
    "NotificationPanelWindow.test.ts": {
      "description": "Tests for the NotificationPanelWindow component"
    },
    "NotificationPanelWindow.vue": {
      "description": "Window wrapper for the NotificationPanel component"
    },
    "PromptGeneratorWindow.test.ts": {
      "description": "Tests for the PromptGeneratorWindow component"
    },
    "PromptGeneratorWindow.vue": {
      "description": "Window wrapper for the PromptGenerator component"
    },
    "SharePanelWindow.test.ts": {
      "description": "Tests for the SharePanelWindow component"
    },
    "SharePanelWindow.vue": {
      "description": "Window wrapper for the SharePanel component"
    },
    "UnifiedEditorWindow.test.ts": {
      "description": "Tests for the UnifiedEditorWindow component"
    },
    "UnifiedEditorWindow.vue": {
      "description": "Window wrapper for the UnifiedEditor component"
    }
  }
}
