{
  "$schema": "../metamode.schema.json",
  "name": "src",
  "description": "Main application source code for isocubic",
  "languages": ["typescript", "vue", "glsl"],
  "files": {
    "main.ts": {
      "description": "Application entry point — creates Vue app, mounts Pinia store"
    },
    "App.vue": {
      "description": "Root Vue component with layout, toolbar, and scene"
    },
    "App.css": {
      "description": "Global application styles"
    },
    "App.vue.test.ts": {
      "description": "Unit tests for the root App component"
    },
    "index.css": {
      "description": "Base CSS reset and global styles"
    },
    "vite-env.d.ts": {
      "description": "Vite environment type declarations"
    }
  },
  "directories": {
    "components": {
      "description": "Vue UI components (editor, preview, panels, windows)",
      "metamode": "components/metamode.json"
    },
    "composables": {
      "description": "Vue composables for reusable reactive logic",
      "metamode": "composables/metamode.json"
    },
    "domain": {
      "description": "Framework-agnostic canonical persisted-data domain boundaries",
      "metamode": "domain/metamode.json"
    },
    "lib": {
      "description": "TypeScript library modules (core logic, utilities, AI)",
      "metamode": "lib/metamode.json"
    },
    "types": {
      "description": "TypeScript type definitions and schemas",
      "metamode": "types/metamode.json"
    },
    "shaders": {
      "description": "GLSL shaders for parametric and energy cube rendering",
      "metamode": "shaders/metamode.json"
    },
    "store": {
      "description": "Pinia state management stores",
      "metamode": "store/metamode.json"
    },
    "test": {
      "description": "Test setup and configuration",
      "metamode": "test/metamode.json"
    },
    "e2e": {
      "description": "End-to-end integration tests",
      "metamode": "e2e/metamode.json"
    }
  }
}
