{
  "$schema": "../../metamode.schema.json",
  "name": "god-mode",
  "description": "Standalone package for GOD MODE AI-assisted development panel",
  "languages": ["typescript", "vue"],
  "files": {
    "package.json": {
      "description": "NPM package manifest for god-mode"
    },
    "tsconfig.json": {
      "description": "TypeScript configuration for god-mode package"
    },
    "README.md": {
      "description": "GOD MODE package documentation"
    }
  },
  "directories": {
    "src": {
      "description": "Package source code",
      "metamode": "src/metamode.json"
    },
    "examples": {
      "description": "Usage examples",
      "metamode": "examples/metamode.json"
    }
  }
}
