{
  "$schema": "../../metamode.schema.json",
  "name": "metamode",
  "description": "Standalone package for MetaMode AI-assisted development panel",
  "languages": ["typescript", "vue"],
  "files": {
    "package.json": {
      "description": "NPM package manifest for metamode"
    },
    "tsconfig.json": {
      "description": "TypeScript configuration for metamode package"
    },
    "README.md": {
      "description": "MetaMode package documentation"
    }
  },
  "directories": {
    "src": {
      "description": "Package source code",
      "metamode": "src/metamode.json"
    },
    "examples": {
      "description": "Usage examples",
      "metamode": "examples/metamode.json"
    }
  }
}
