{
  "$schema": "../../metamode.schema.json",
  "name": "server/src",
  "description": "Server source code: authentication, HTTP, WebSocket, sessions",
  "languages": ["typescript"],
  "files": {
    "index.ts": {
      "description": "Server entry point"
    },
    "auth.ts": {
      "description": "Authentication middleware and token validation"
    },
    "auth.test.ts": {
      "description": "Tests for authentication module"
    },
    "http-server.ts": {
      "description": "HTTP server setup and REST endpoints"
    },
    "websocket-server.ts": {
      "description": "WebSocket server for real-time collaboration"
    },
    "session-store.ts": {
      "description": "Session storage and management"
    },
    "session-store.test.ts": {
      "description": "Tests for session storage"
    },
    "types.ts": {
      "description": "TypeScript type definitions for server modules"
    }
  }
}
