{
  "$schema": "../../metamode.schema.json",
  "name": "types",
  "description": "TypeScript type definitions, interfaces, and JSON schemas for the application",
  "tags": ["types", "interfaces", "schemas"],
  "files": {
    "cube.ts": {
      "description": "Core cube parameter types (CubeParams, FFT coefficients, materials)"
    },
    "cube.test.ts": {
      "description": "Tests for cube type utilities"
    },
    "cube-schema.json": {
      "description": "JSON Schema for validating cube configuration files"
    },
    "component-meta.ts": {
      "description": "Component metadata system: self-documenting component registry"
    },
    "component-meta.test.ts": {
      "description": "Tests for component metadata system"
    },
    "lod.ts": {
      "description": "Level of Detail types and configuration"
    },
    "stack.ts": {
      "description": "Cube stack types for scene management"
    },
    "stack.test.ts": {
      "description": "Tests for stack types"
    },
    "collaboration.ts": {
      "description": "Real-time collaboration types (sessions, users, operations)"
    },
    "collaboration.test.ts": {
      "description": "Tests for collaboration types"
    },
    "websocket.ts": {
      "description": "WebSocket message types and protocol definitions"
    },
    "websocket.test.ts": {
      "description": "Tests for WebSocket types"
    },
    "auth.ts": {
      "description": "Authentication types (tokens, sessions, permissions)"
    },
    "auth.test.ts": {
      "description": "Tests for auth types"
    },
    "god-mode.ts": {
      "description": "GOD MODE types for AI-assisted development panel"
    },
    "god-mode.test.ts": {
      "description": "Tests for GOD MODE types"
    },
    "ai-query.ts": {
      "description": "AI query types for natural language component search"
    },
    "ai-query.test.ts": {
      "description": "Tests for AI query types"
    },
    "issue-generator.ts": {
      "description": "Types for automated GitHub issue generation"
    },
    "issue-generator.test.ts": {
      "description": "Tests for issue generator types"
    },
    "community.ts": {
      "description": "Community feature types (profiles, ratings)"
    },
    "community.test.ts": {
      "description": "Tests for community types"
    },
    "share.ts": {
      "description": "Sharing and export types"
    },
    "share.test.ts": {
      "description": "Tests for share types"
    },
    "social.ts": {
      "description": "Social features types (comments, likes, follows)"
    },
    "social.test.ts": {
      "description": "Tests for social types"
    },
    "publishing-api.ts": {
      "description": "Publishing API types for cube marketplace"
    },
    "publishing-api.test.ts": {
      "description": "Tests for publishing API types"
    }
  }
}
